sample_id,catalog_content,image_link,price_x,declared_quantity,certifications_0,certifications_1,certifications_2,variant,target_demographic,country_of_origin,manufacturer,is_organic,is_natural,edible,is_premium,is_bundle_deal,is_limited_edition,price_y,brand_name,product_name,category,product_form,declared_unit,packaging_type,packaging_material,overall_summary
293723,"Item Name: Frontier Co-op Ground Turmeric Root, 1-pound Bulk Bag, Distinct Aroma, Ginger & Pepper-Like Flavor, Kosher, Non-GMO
Bullet Point 1: 1 pound bulk bag (Pack of 3)
Bullet Point 2: Warm, aromatic and brightly colored spice
Bullet Point 3: A staple in Indian cooking
Bullet Point 4: Non-GMO Project Verified, Kosher, non-irradiated, Botanical name: Curcuma longa L
Bullet Point 5: Frontier is a member-owned co-op, responsible to people and planet
Value: 48.0
Unit: Ounce
",https://m.media-amazon.com/images/I/61DC01CVWwL.jpg,11.45,48.0,Non-GMO Project Verified,Kosher,,1-pound Bulk Bag (Pack of 3),unisex,,,,,1,0,1,0,,Frontier Co-op,Ground Turmeric Root,Grocery & Gourmet Food,powder,oz,bag,plastic,"Bulk turmeric powder from a cooperative brand, positioned as a value-oriented spice with non-GMO and kosher certifications. The 48 oz pack of 3 bags suggests a cost-effective, high-volume purchase for home or commercial use. Basic plastic packaging and lack of premium branding indicate a focus on affordability and utility over luxury."
268023,"Item Name: Tone's Italian Spaghetti Seasoning Blend (14 oz.)
Bullet Point: Italian spaghetti seasoning blend
Value: 14.0
Unit: Ounce
",https://m.media-amazon.com/images/I/81t4Yj8sCpL.jpg,12.17,14.0,,,,,unisex,,,,,1,0,0,0,,Tone's,Italian Spaghetti Seasoning Blend,Grocery & Gourmet Food,,oz,jar,plastic,"A seasoning blend for Italian spaghetti, positioned as a versatile kitchen staple. The 14 oz plastic jar suggests a mid-size, everyday-use product with no premium or organic claims. Gluten-free and no MSG labels may appeal to health-conscious consumers but do not indicate a price premium. The product is likely priced competitively within the spice/seasoning category."
183248,"Item Name: Kar's Sweet 'n Salty Mix (2 Ounce, 40 Count)
Value: 80.0
Unit: Ounce
",https://m.media-amazon.com/images/I/816-qKA221L.jpg,26.525,80.0,,,,"2 Ounce, 40 Count",unisex,,,,,1,0,1,0,,Kar's,Sweet 'n Salty Mix,Grocery & Gourmet Food,solid,oz,bag,plastic,"A bulk pack of individual snack bags, positioned as a value-oriented multipack. The 'New Larger Count' label suggests a competitive pricing strategy for volume buyers. Gluten-free claim may appeal to a niche market but does not indicate premium quality. Standard plastic packaging and absence of premium branding indicate a mid-range price point."
102908,"Item Name: Organic Whole Red Lentils Dry (1)
Bullet Point: Organic Dry Whole Red Lentils
Product Description: USA grown lentils. Lentils are a very good source of dietary fiber, copper, phosphorus and manganese. iron, protein, vitamin B1, pantothenic acid, zinc, potassium and vitamin B6.
Value: 16.0
Unit: Fl Oz
",https://m.media-amazon.com/images/I/51P4WL4N7TL.jpg,21.99,16.0,,,,,unisex,USA,,1.0,,1,0,0,0,,,Organic Whole Red Lentils Dry,Grocery & Gourmet Food,solid,fl_oz,,,"Organic whole red lentils positioned as a health-focused, nutrient-rich food product. USA origin and organic certification suggest a premium positioning, though basic packaging and standard product form indicate mid-range pricing. Nutrient density and organic claims may justify a higher price point compared to conventional lentils."
272925,"Item Name: Tetley Extra Strong Tea Bags 75 per pack - Pack of 2
Value: 150.0
Unit: Count
",https://m.media-amazon.com/images/I/61p4UbCzzLL.jpg,28.95,150.0,,,,75 tea bags,unisex,,,,,1,0,1,0,,Tetley,Tetley Extra Strong Tea Bags,Grocery & Gourmet Food,Tea Bags,count,box,cardboard,"Tetley Extra Strong Tea Bags are positioned as a mid-range tea product with a strong flavor profile. The packaging indicates a bundle deal with 150 tea bags (pack of 2), suggesting value for money. The brand's long-standing presence (since 1837) implies reliability, while the absence of premium or organic claims aligns it with standard tea offerings."
261160,"Item Name: Sonoma Syrup Co Classic Simple Syrup, 25.4 Fl Oz for Coffee, Cocktails, and Cooking
Bullet Point 1: Rich, Flavor-Infused Simple Syrup: Enjoy the luxurious sweetness of pure cane sugar, infused with a hint of vanilla for an added depth of flavor that blends seamlessly into cocktails, iced tea, coffee, and baked goods.
Bullet Point 2: A Mixologist's Must-Have: Favored by top bartenders and culinary experts, Classically Simple Syrup is the perfect ingredient for crafting timeless cocktails like Gimlets, Daiquiris, and Old Fashioneds, plus it adds the perfect touch to iced coffee or Southern Sweet Tea.
Bullet Point 3: Versatile Culinary Staple: This all-purpose syrup is ideal for sweetening a wide range of beverages, from morning coffee to weekend margaritas. Use it as a glaze for cakes, cookies, or even in savory dishes for added sweetness and balance.
Bullet Point 4: No Artificial Additives: Made without artificial flavors, colors, or preservatives. Non-GMO and free from any harmful chemicals, ensuring you enjoy pure, natural sweetness in every drop.
Bullet Point 5: Handcrafted in Small Batches, USA-Made: Carefully crafted in small batches in the USA, ensuring premium quality and consistency with every bottle. No refrigeration required – just keep it in your pantry for easy access.
Product Description: Founded in 2022, Sonoma Syrup Co. handcrafted, small batch Artisanal Simple Syrup, Extract Blends, and Classic Bar Mixers reflect the exceptional ingredients and authentic flavors of Northern California's Wine Country.
Value: 25.4
Unit: Fl Oz
",https://m.media-amazon.com/images/I/61QcSZRdlWL.jpg,27.95,25.4,,,,,unisex,USA,,,1.0,1,1,0,0,,Sonoma Syrup Co.,Classic Simple Syrup,Grocery & Gourmet Food,liquid,fl_oz,bottle,glass,"Premium artisanal syrup positioned as a high-quality, natural sweetener for beverages and cooking. Glass bottle packaging and small-batch production suggest a mid-to-high price point. 'All natural' and 'non-GMO' claims reinforce premium positioning, while versatility across cocktails, coffee, and desserts justifies a higher cost compared to standard simple syrups."
236634,"Item Name: BUSH'S BEST Garbanzos Chick Peas, 16oz (Pack of 9)
Bullet Point 1: Stock your pantry with 16 oz recyclable cans of Bush’s Garbanzo Beans
Bullet Point 2: Bush’s Garbanzo Beans are delicious, hearty beans with a nutty flavor
Bullet Point 3: Bush’s Variety Beans offer the nutritional benefits and versatility you need, making them a staple for soups, rice, dips or whatever dish you think up next
Bullet Point 4: Gluten and cholesterol free and low fat
Bullet Point 5: A pantry staple with 6g of plant-based protein (9% DV) and 4g of fiber (14% DV) per serving
Product Description: Cooking and creativity go hand in hand. That’s why Bush’s Garbanzo Beans don’t stop at offering plant-based protein and fiber – they open up a whole world of versatility and inspiration. And while some people call them ""chickpeas,"" everyone agrees they're delicious. Their hearty, nutty flavor makes them perfect in salads and stews, blended into hummus, fried as falafel and more. So even if you don't know exactly what your next creation is going to be, you can rest assured it’s going to be great.
Value: 144.0
Unit: Ounce
",https://m.media-amazon.com/images/I/71-8ozFUQnL.jpg,1.335,16.0,,,,,unisex,,,,,1,0,1,0,,BUSH'S BEST,Garbanzos Chick Peas,Grocery & Gourmet Food,solid,oz,can,metal,Mid-range pantry staple with a focus on nutritional benefits and versatility. Standard can packaging and absence of premium claims suggest a budget-friendly positioning. Bundle deal of 9 cans offers bulk value for home use.
198516,"Item Name: M.G. PAPPAS Aged White Balsamic Vinegar - Barrel Aged Balsamic from Italy - Balsamic White Vinegar for Cooking, Vinaigrettes, Salads, Dressings - No Preservatives, No Added Sugar - 8.5 Oz (250ml)
Bullet Point 1: 【Authentic Balsamic Vinegar Made In Italy】100% of our grapes are sourced directly from Italy, allowing us to offer you a rich and authentic premium quality Italian balsamic vinegar that is unmatched. Experience its slight syrupy consistency with a sweet and fruity taste.
Bullet Point 2: 【Aged White Balsamic Vinegar】We believe the best balsamic vinegar is barrel-aged. This method allows for a mature, brilliant, and a clear white -colored finished product that only contains 4% acidity.
Bullet Point 3: 【Rich Flavor】Our Traditional style balsamic vinegars are gourmet quality, with a well-balanced flavor profile it is sweet, low in acidity, provides a fragrant aroma, and the finish has a slightly syrup-like consistency
Bullet Point 4: 【No Artificial Ingredients】The secret to our great taste is simplicity, this balsamic vinegar has two ingredients: cooked grape must and wine vinegar, which means there are no thickening agents, no caramel, no added flavors, no artificial additives, no colorants, and no preservatives.
Bullet Point 5: 【Delicious Pairings】Pair with our unique signature olive oils for a flavorful, aromatic vinaigrette or make a great-tasting balsamic vinegar dressing to enjoy with salads, fish, cheese, bread, and so much more!
Product Description: Flavorful Balsamic Vinegar White in its purest form! M.G. PAPPAS is an authentic and true premium quality Italian Balsamic Vinegar from Italy, known as the center of the balsamic vinegar world. It is sweet with a slight pungency. Barrel-aged for years, the appearance of our balsamic vinegar is brilliant, it is white almost clear colored, with a strong aroma, a delicate acidic, and a well-balanced sweetness. It has only two ingredients: cooked grape must and white wine vinegar. Makes a perfect sweet white balsamic vinaigrette or a white balsamic vinegar dressing.
Value: 1.0
Unit: Fl Oz
",https://m.media-amazon.com/images/I/61GZKd-aFFL.jpg,23.98,8.5,,,,,unisex,Italy,,,1.0,1,1,0,0,,M.G. PAPPAS,Aged White Balsamic Vinegar,Grocery & Gourmet Food,liquid,fl_oz,bottle,glass,"Premium Italian balsamic vinegar with barrel-aged quality, positioned as a gourmet condiment. Glass bottle packaging and natural ingredients suggest higher-end pricing. No artificial additives or preservatives, emphasizing purity and authenticity. Targeted at culinary enthusiasts seeking high-quality dressings and flavor pairings."
157544,"Item Name: Sara Lee Iced Double Chocolate Sheet Cake, 12 x 16 inch -- 4 per case.
Bullet Point: Ships frozen, CANNOT be cancelled after being processed.
Product Description: Sara Lee Iced Double Chocolate Sheet Cake, 12 x 16 inch -- 4 per case. Moist chocolate cake topped with a dark chocolate frosting
Value: 4.0
Unit: Count
",https://m.media-amazon.com/images/I/51VG70ov6OL.jpg,162.96,4.0,,,,12 x 16 inch,unisex,,,,,1,0,1,0,,Sara Lee,Iced Double Chocolate Sheet Cake,Grocery & Gourmet Food,solid,count,,,"A standard commercial bakery product positioned as a bulk value pack for foodservice or large gatherings. The 4-count case format and sheet cake size suggest a cost-effective, high-volume offering rather than a premium or artisanal item. Shipping as frozen and the lack of premium descriptors indicate this is a mainstream, budget-friendly product."
279638,"Item Name: Ritter Sport Milk Chocolate with Whole Almonds Bar, 3.5 Ounce (Pack of 11).
Bullet Point 1: Ritter Sport alludes quality without creating false expectations.
Bullet Point 2: The Ritter Sport brand stands for a modern, high-quality and innovative chocolate brand for a broad consumer group.
Bullet Point 3: Each Ritter Sport chocolate is made with high-quality raw materials while doing business in harmony with nature.
Bullet Point 4: Ritter Sport successfully implement measures that have a positive effect on people who depend on growing cocoa and other raw ingredients, and constantly measure and evaluate our environmental impact.
Bullet Point 5: Product of Germany.
Value: 38.5
Unit: Ounce
",https://m.media-amazon.com/images/I/81dYuAnUT0L.jpg,4.59,3.5,,,,3.5 Ounce (Pack of 11),unisex,Germany,,,1.0,1,1,1,0,,Ritter Sport,Milk Chocolate with Whole Almonds Bar,Grocery & Gourmet Food,bar,oz,wrapper,cardboard,"Premium European chocolate brand positioned as high-quality and innovative. The packaging emphasizes natural ingredients and sustainable sourcing, suggesting a mid-to-high price point. The bundle deal of 11 bars indicates value-oriented packaging, but the brand's focus on quality and sustainability may justify a higher price per unit."
