sample_id,catalog_content,image_link,price_x,declared_quantity,certifications_0,certifications_1,certifications_2,variant,target_demographic,country_of_origin,manufacturer,is_organic,is_natural,edible,is_premium,is_bundle_deal,is_limited_edition,price_y,brand_name,product_name,category,product_form,declared_unit,packaging_type,packaging_material,overall_summary
82808,"Item Name: Snow's by Bumble Bee Chopped Clams in Clam Juice (6 pack - 6.5oz each can)
Value: nan
Unit: None
",https://m.media-amazon.com/images/I/613ZDN-wObL.jpg,13.92,6.0,,,,6 pack - 6.5oz each can,unisex,United States,Bumble Bee Seafoods,,,1,0,1,0,,Bumble Bee,Snow's Chopped Clams in Clam Juice,Grocery & Gourmet Food,liquid,count,bag,plastic,"Standard multipack of canned clams, positioned as a budget-friendly seafood option. Plastic packaging and absence of premium claims suggest mid-range pricing. Bundle deal offers value per unit for household consumption. No organic or specialty certifications indicated."
181380,"Item Name: Tuscany Oro Selecto Organic Espresso, Whole Bean, 5-Pound Bag
Bullet Point: ORO SELECTO ORGANIC ESPRESSO:: Roasted to create a sophisticated European coffee experience, our deliciously balanced Italian coffee has smooth, robust flavor that will make you feel like you're sipping outside an Italian Café
Product Description: Roasted to create a sophisticated European coffee experience, Tuscany Oro Selecto Espresso lives up to Italian tradition to produce a smooth tasting espresso with sweet crème and rich flavor. Using 100% Arabica beans, Tuscany roasts beans in small batches for the finest coffee and then packages them at the peak of their cycle to preserve their natural flavors and fresh-roasted quality. For freshness, store coffee in an airtight container away from light, heat, and moisture. Tuscany crafts its coffees according to Italian tradition, with long-practiced roasting techniques that help preserve taste and freshness for the discerning coffee lover.
Value: 80.0
Unit: Fl Oz
",https://m.media-amazon.com/images/I/71Gxhs1hVCL.jpg,77.96,5.0,,,,"Whole Bean, 5-Pound Bag",adult,,,1.0,,1,1,0,0,,Tuscany,Oro Selecto Organic Espresso,Grocery & Gourmet Food,Whole Bean,lb,bag,plastic,Premium organic coffee positioned for discerning coffee lovers with European-style sophistication. High-quality packaging and small-batch roasting suggest a mid-to-high price point. 100% Arabica beans and Italian tradition enhance perceived value.
230663,"Item Name: Sprecher Root Beer, Great Tasting, Handcrafted, Fire Brewed, Gourmet,Craft Soda, 16oz Can 12 Pack
Value: 192.0
Unit: Fl Oz
",https://m.media-amazon.com/images/I/71g5gduG3AL.jpg,8.96,12.0,,,,16 FL OZ,unisex,,,,,1,1,1,0,,Sprecher,Root Beer,Grocery & Gourmet Food,liquid,count,carton,mixed,"Premium craft soda positioned as a handcrafted, fire-brewed gourmet product. The 12-pack bundle deal offers value for bulk purchases, while the 16 FL OZ can size and 'great tasting' branding suggest a higher price point than standard sodas. Packaging quality and craft positioning justify a premium segment placement."
240017,"Item Name: Simply Sunflower All-Natural Sunflower Oil | Non GMO, Gluten-Free, Vegan | Heart Healthy Cooking Oil | 6 Pack of 16 oz Bottles | Made in Nebraska, USA
Bullet Point 1: ALL NATURAL - Simply Sunflower Oil comes from fresh sunflowers grown on Nebraska farms. These high oleic sunflower seeds are cold pressed without the use of chemicals to offer all natural, unrefined, virgin oil. Simply Sunflower Oil is gluten-free, non-GMO, OK Kosher Pareve Certified, Trans-Fat Free, and all-American made.
Bullet Point 2: HEALTHY - Simply Sunflower Oil is a versatile, trans fat-free oil low in saturated fats. It is High Oleic! High Oleic Sunflower oil is more healthy than mid-oleic and linoleic sunflower oil. It contains higher Oleic fatty acids (monounsaturated fat - this is the good fat you need for energy) and less linoleum acids (polyunsaturated fats).
Bullet Point 3: EXCELLENT FOR COOKING - The high smoke point of 450 degrees makes Simply Sunflower Oil optimal for cooking and frying. It provides a clean, light taste allowing the flavors of food to shine through.
Bullet Point 4: DIET AND ALLERGEN FRIENDLY - Simply Sunflower Oil is produced in an independent facility that only processes all-natural sunflower oil. The Simply Sunflower production facility is free of soy, peanuts, tree nuts and all other top allergens. Simply Sunflower Oil is non-GMO, gluten-free, nut-free, vegan, and heart healthy. It's popular for Paleo, Vegan, Whole30, and several other healthy diets.
Bullet Point 5: COLD-PRESSED AND UNREFINED - Our high oleic sunflower seeds are mechanically cold-pressed to preserve the natural antioxidants and nutrients - including 41% Vitamin E. Many refined oils use chemicals, but we cold-press and filter our oil without the use of any chemicals or preservatives.
Bullet Point 6: SUSTAINABLY GROWN - These sunflowers are grown using eco-friendly farming practices. They are included in a crop rotation to enrich the soil we've been farming in Nebraska for over 120 years. Our oil is packaged in a BPA-free, high quality plastic bottle with a non-drip bericap. This is safe for the consumer and ideal for recycling after use.
Product Description: Enjoy a true culinary delight with Simply Sunflower's All Natural Sunflower Oil. This oil provides a clean, light taste that allows the flavors of food to shine through. It's a healthy, all-natural alternative that can be used as a dressing or high-temperature frying oil and can replace any oil you currently use. <br> ALL NATURAL - Simply Sunflower Oil comes from fresh sunflowers grown on Nebraska farms. These high oleic sunflower seeds are cold pressed without the use of chemicals to offer all natural, unrefined, virgin oil. Simply Sunflower Oil is gluten-free, non-GMO, OK Kosher Pareve Certified, Trans-Fat Free, and all-American made. <br> HEALTHY - Simply Sunflower Oil is a versatile, trans fat-free oil low in saturated fats. It is High Oleic! High Oleic Sunflower oil is more healthy than mid-oleic and linoleic sunflower oil. It contains higher Oleic fatty acids (monounsaturated fat - this is the good fat you need for energy) and less linoleum acids (polyunsaturated fats). <br> EXCELLENT FOR COOKING - The high smoke point of 450 degrees makes Simply Sunflower Oil optimal for cooking and frying. It provides a clean, light taste allowing the flavors of food to shine through. <br> DIET AND ALLERGEN FRIENDLY - Simply Sunflower Oil is produced in an independent facility that only processes all-natural sunflower oil. Simply Sunflower Oil is non-GMO, gluten-free, nut-free, vegan, and heart healthy. It's popular for Paleo, Vegan, Whole30, and several other healthy diets. <br> COLD-PRESSED AND UNREFINED - Our high oleic sunflower seeds are mechanically cold-pressed to preserve the natural antioxidants and nutrients - including 41% Vitamin E. Many refined oils use chemicals, but we cold-press and filter our oil without the use of any chemicals or preservatives. <br> SUSTAINABLY GROWN - These sunflowers are grown using eco-friendly farming practices. They are included in a crop rotation to enrich the soil we've been farming in Nebraska for over 120 years. Our oil is packaged in a BPA-free, high quality plastic bottle with a non-drip bericap. This is safe for the consumer and ideal for recycling after use. <br> Simply Sunflower was born as a result of Farmer Al striving to be a better steward of the environment. He began using sunflowers as a renewable energy source on their farm and ranch near Ord, Nebraska. His farm has been in the Koelling family for the past 120 years! The soil is rich in history, heritage, and sunflowers!
Value: 96.0
Unit: Fl Oz
",https://m.media-amazon.com/images/I/81CT2mS2fxL.jpg,5.380000000000001,96.0,Non-GMO Verified,OK Kosher Pareve,,6 Pack of 16 oz Bottles,unisex,USA,,,1.0,1,0,1,0,,Simply Sunflower,All-Natural Sunflower Oil,Grocery & Gourmet Food,liquid,fl_oz,bottle,plastic,"Mid-tier health-focused cooking oil with strong natural and allergen-friendly claims. Multi-pack offering provides bulk value, while cold-pressed and high-oleic positioning justifies a premium over standard oils. BPA-free plastic packaging and sustainable sourcing add to perceived quality. Pricing likely balanced between health benefits and commodity oil costs."
163372,"Item Name: Kraft Minute Tapioca, 8 Oz
Value: 8.0
Unit: Ounce
",https://m.media-amazon.com/images/I/21A8gLnRO4L.jpg,39.8,0.5,,,,,unisex,,,,,0,1,0,0,,NYX,Roll On Shimmer,Beauty & Personal Care,liquid,fl_oz,bottle,glass,"Premium beauty product with sleek glass packaging and a metallic applicator, suggesting a higher-end positioning. The 0.5 fl oz size is standard for roll-on shimmer products, and the brand's reputation for quality and affordability aligns with mid-range pricing. No certifications or organic claims are visible, focusing on cosmetic performance and aesthetic appeal."
240295,"Item Name: Holle Organic Baby Food Pouches - Power Parrot Baby Puree with Pear, Apple & Spinach - (6 Pack) Organic Baby Snacks + Fruit and Veggie Pouches for Weaning Babies 6 Months and Older
Bullet Point 1: Healthy Organic Ingredients - Our Power Parrot organic baby food pouches contain a tasty blend of organic pear, apple and spinach. Each of our fruit and veggie pouches is made with100% Demeter-certified, biodynamic fruit, vegetables and grains.
Bullet Point 2: Try all Eight Flavors - This box contains six pouches of finely pureed organic fruit and vegetables grown on regenerative farms. We offer these organic baby snacks in eight different flavors, and each is made without any added salt or refined sugar.
Bullet Point 3: A Great, No-Prep Snack - These convenient baby pouches make it easy to bring your favorite pureed foods on the go. They can serve as quick, healthy baby snacks between meals and fit right into lunch boxes and backpacks.
Bullet Point 4: Easy to Store - These shelf stable food pouches make it easy to always keep a quick, easy baby snack on hand. The pouch is BPA-free and resealable, so you can seal it up and store it in the fridge for up to two days after opening.
Bullet Point 5: Commitment To Quality - Holle uses only high quality ingredients and we bear a special responsibility for the environment, children, and their future. We promote holistic, sustainable nutrition based on simple recipes and baby food meals without chemical processing or use of preservatives, artificial flavors or colors, added salt or granulated sugar.
Product Description: When it comes to baby snack foods and baby meals, Holle babyfood has you covered. Each baby food pouch we create contains a unique baby food puree, and our formulas make it easy to reimagine what baby organic food can be. For example, our baby fruit pouches contain a wide range of ingredients like banana puree, mango puree, prune puree, mango baby food, pear puree baby food and more. Our baby food squeeze pouches come in 6 different flavors, so you can find a veggie pouch made with baby food vegetables like sweet potato puree or butternut squash puree. Each of our baby puree pouches is suitable 6 month baby food, so if you're looking for baby food 6 months old and older can enjoy, these are the baby snacks 6+ months old will love. Our varied range of baby foods and organic baby pouches, also makes it easy to build your own baby food variety pack; so be sure to shop all of our baby squeeze pouches to find the fruit pouch or other baby pouch your child will love. Our organic pouches are determined to convince parents that there are more to baby snacks 6 months old can love, so if you thought baby food organic options ended with prune pouches, stop limiting your search to baby prunes and prune baby food; because your baby deserves more than a normal prune pouch, and it will be a while before they can chomp down on organic baby carrots.
Value: 21.0
Unit: Fl Oz
",https://m.media-amazon.com/images/I/71UpXJskeRL.jpg,13.99,3.5,USDA Organic,Non-GMO,Demeter Certified Biodynamic,6 Pack,baby,,,1.0,1.0,1,1,1,0,,Holle,"Organic Baby Food Pouches - Power Parrot Baby Puree with Pear, Apple & Spinach",Grocery & Gourmet Food,liquid,fl_oz,pouch,plastic,"Premium organic baby food with high-quality, biodynamic ingredients and multiple certifications. Convenient, resealable pouches designed for on-the-go use, targeting health-conscious parents. Multi-pack deal enhances value, with a focus on natural, additive-free nutrition for infants 6 months and older."
226735,"Item Name: Farmhouse Fudge - Build Your Own Fudge Box Sampler - Fresh Fudge made with Butter and Cream, no Marshmallows! Over 40 Flavors - Perfect treat for everyone!
Bullet Point 1: CUSTOMIZABLE OPTIONS: Build your perfect box with 3, 6, or 12 pieces of your favorite fudge flavors!
Bullet Point 2: BEST VALUE FOR PREMIUM FUDGE: Farmhouse Fudge delivers unbeatable quality at the best price, offering rich, decadent flavors without breaking the bank. As low as $1.03/ounce!
Bullet Point 3: ENDLESS FLAVOR VARIETY: Choose from over 40 year-round flavors, along with an array of seasonal favorites. Whether you're craving classic chocolate or adventurous combinations, there’s a flavor for every taste.
Bullet Point 4: GUARANTEED FRESHNESS: Every piece of our fudge is individually wrapped to lock in freshness, ensuring a perfect, melt-in-your-mouth bite every time.
Bullet Point 5: LONG SHELF LIFE: Our fudge stays fresh for up to 3 months without refrigeration! For longer storage, freeze it and enjoy it for up to a year.
Bullet Point 6: VERSATILE SWEET TREAT: Savor the fudge as-is or heat it up for an irresistible sundae topping. With so many ways to enjoy, find your new favorite way to indulge.
Bullet Point 7: HANDCRAFTED IN THE USA: Proudly made using only the finest ingredients, Farmhouse Fudge continues the classic American tradition of crafting fudge with care and expertise.
Product Description: Introducing the ultimate fudge lover's dream: our Build Your Own Fudge Box! With over 40 delicious flavors to choose from, you'll be able to create the perfect combination for yourself or as a gift for a loved one. Each box contains creamy, mouth-watering fudge, made with the finest ingredients and crafted to perfection. Treat yourself to a taste sensation, or share the love and send a box to a friend. Order now and start building your perfect fudge box! Each piece comes individually wrapped with flavor and ingredients label. We ship our fudge fresh out super fresh via either UPS or USPS Priority Mail. Fudge WILL arrive soft in warm temperatures. This is perfectly normal. Fudge that arrives soft can be refrigerated for a short time to bring it to slicing consistency. Properly stored, your fudge will stay fresh for 3 months.
Value: 1.0
Unit: Count
",https://m.media-amazon.com/images/I/51KzAdoMI5L.jpg,28.95,1.0,,,,,unisex,United States,,,,1,1,1,0,,Farmhouse Fudge,Build Your Own Fudge Box Sampler,Grocery & Gourmet Food,solid,count,box,cardboard,"Premium handcrafted fudge with a focus on quality and customization. The product is positioned as a high-value treat with a wide variety of flavors and individually wrapped pieces for freshness. The packaging and branding emphasize craftsmanship and American tradition, suggesting a mid-to-high price range. The ability to customize the box size and flavor selection adds to its appeal as a gift or personal indulgence."
61810,"Item Name: Blueberry Boba Pearls Blueberry Popping Boba Bursting Boba Blueberry Bubble Tapioca Pearls For Bubble Tea (Blueberry, 7 LB 1 Pack)
Bullet Point 1: THE EXPERIENCE - From its authentic Taiwan origin, our Blueberry flavored Bursting Balls will bring to you the ultimate Boba popping experience! The translucent popping Boba pearls are filled with a delightful fruity liquid that bursts wonderfully in the mouth and will transform your snacking to a new level of pure goodness.
Bullet Point 2: QUALITY - Containing a shelf life of up to one year these sweet treats will last you quite a while! Store unopened in a cool dry place and refrigerate after opening. Choose from our pack options of mango, blueberry, passion, pomegranate and strawberry popping boba!
Bullet Point 3: OPTIONS - Redefine your standards in desserts and drinks. Add our blueberry boba popping pearls to yogurt, waffles, ice cream, cake, cold drinks, smoothies, tea and more for a satisfying sensation to tickle your taste buds. You'll embellish the simplest of foods to pure delicacies!
Bullet Point 4: TREAT FOR ALL - Tasty and mess-free, the tapioca pearls for bubble tea are a perfect way to enjoy a café-quality experience in your own home! Stun your guests, tempt your friends, and enjoy a tasty snacking without much effort. For birthday parties, events, office snacking or any occasion enjoy the tingling and delightful experience! These popping pearl tea balls will be a perfect treat on Halloween, Christmas, Valentine's Day or any other holiday. Get it for yourself or gift a loved one!
Bullet Point 5: PURE GOODNESS - Filled with natural fruity goodness and an excellent source of calcium join the Boba trend that is fast becoming the most popular of foods. A favorite in oriental and Japanese snacks, these instant Boba bubbles will become your newest pantry must have!
Product Description: THE EXPERIENCE - From its authentic Taiwan origin, our Blueberry flavored Bursting Balls will bring to you the ultimate Boba popping experience! The translucent popping Boba pearls are filled with a delightful fruity liquid that bursts wonderfully in the mouth and will transform your snacking to a new level of pure goodness.
Value: 112.88
Unit: Ounce
",https://m.media-amazon.com/images/I/91RO2fTKcXL.jpg,37.57,112.88,,,,Blueberry,unisex,Taiwan,,,,1,0,0,0,,BREXONIC,Bursting Balls Blueberry,Grocery & Gourmet Food,granule,oz,container,plastic,"Boba pearls positioned as an affordable snacking and beverage additive, targeting the growing bubble tea trend. Standard plastic packaging and no premium certifications suggest mid-range pricing. Large quantity (112.88 oz) indicates bulk value, suitable for home use or events. Branding emphasizes authenticity and versatility rather than luxury."
37750,"Item Name: Imagine Foods Organic Creamy Tomato Soup 32 OZ
Value: 32.0
Unit: Ounce
",https://m.media-amazon.com/images/I/418smr0toRL.jpg,5.68,32.0,USDA Organic,,,,unisex,,,1.0,1.0,1,0,0,0,,Imagine Foods,Organic Creamy Tomato Soup,Grocery & Gourmet Food,liquid,oz,carton,cardboard,"Organic soup from Imagine Foods, positioned as a natural and USDA-certified product. Standard 32 oz carton packaging with no premium indicators suggests mid-range pricing. Organic certification and natural claims may justify a slight premium over conventional soups."
257170,"Item Name: Bocce's Bakery 856019005235 14 oz. Dog Biscuits - Chicken & Pumpkin
Value: 14.0
Unit: Fl Oz
",https://m.media-amazon.com/images/I/51juQ0DqBcL.jpg,8.49,14.0,,,,,kids,USA,,,1.0,1,0,0,0,,Bocce's Bakery,Dog Biscuits - Chicken & Pumpkin,Pet Supplies,solid,fl_oz,bag,plastic,"A natural, wheat-free dog biscuit product positioned as a tasty treat for pets. The packaging highlights all-natural ingredients and USA origin, suggesting a mid-range quality focus. The absence of premium indicators and standard plastic packaging suggest a balance between quality and affordability."
