sample_id,catalog_content,image_link,price_x,declared_quantity,certifications_0,certifications_1,certifications_2,variant,target_demographic,country_of_origin,manufacturer,is_organic,is_natural,edible,is_premium,is_bundle_deal,is_limited_edition,price_y,brand_name,product_name,category,product_form,declared_unit,packaging_type,packaging_material,overall_summary
58025,"Item Name: Orange Cream Taffy Chews by It's Delish- 4 Oz Bulk Bag - Individually Wrapped Gourmet Soft Fluff Taffy - Perfect Trick or Treat Candy for Orange Themed Parties, USA Made & Kosher
Bullet Point 1: 🟠 PERFECT TREAT ORANGE CREAM TAFFY– Its Delish Bulk Bag soft Orange Cream Taffy toffee (taffy) is for all, LOVES candy so when also comes for Treat or Christmas gifts. Our naturally extracted fruits chew sure won't disappoint! Go ahead, gift them some amazing candy this Holiday season; your taste buds will ""go Orange Cream Taffy "" when you treat them to our Soft Taffy Chews. Try all our flavors; we are sure they will love it and you.
Bullet Point 2: 🟠 SOFY & FLUFFY TOFFEES – Our Soft Orange Cream Taffy is also known as the ""After You Eat Treat,"" so our kids can enjoy one after every meal, up to three per day, for clean teeth and a healthier smile. Enjoy the soft, gooey, and chewy texture and delicious flavors with no guilt, Gluten-free, dairy-free, natural, and mom-approved. Our goal is to provide the most flavorful, true-to-life varieties of soft, whipped-style taffy. With over maximum flavors.
Bullet Point 3: 🟠 YOUR FAVORITE ORANGE CREAM TAFFY– Its Delish Orange Cream Taffy 4 Oz Bulk Bag is favorite among the dentists, teachers, and parents. Ideal for schools, dental and health care offices, and families who love to smile. These healthy treats are perfect for everyone, and great rewards or prizes for young children. Healthy Orange Cream Taffy with a mission to make you smile, whether that's reliving childhood or offering better things for our kids.
Bullet Point 4: 🟠 HEAVENLY THEMED CANDY – It's Delish Taffy is not sugar-free but will contain smile friendly natural ingredients that are good for your teeth too. The variety pack contains Orange Cream Taffy flavor individually wrapped taffies. You can try our delicious taffy treats & you can use them as a treat. Try our other colors and flavors, blueberry, green apple, yellow banana, peppermint and tutti frutti! - Approx. 18 Taffies/Per 4 Ounces.
Bullet Point 5: 🟠 YOU ARE SO VALUABLE – It's easy to spread the love & share the square with your friends or throw some in your pocket or bag to enjoy either. We cherish your involvement in our brand more than everything else. It is Certified that Its Delish, Dairy-Free, Packaged in the USA non-GMO. No additives or preservatives. If you need our help or need to ask something, reach out to us. Our help group will be glad to support you and guarantee that you are 100%.
Product Description: <p> Orange Cream Taffy Chews by It's Delish, 4 Oz Bulk Bag</p><p>&nbsp;</p><p>Our soft Orange Cream Taffy chews are sweet, chewy, and full of flavor. They are made in-house by our Orange Cream Taffy experts and are individually wrapped. Try our Orange Cream flavor. They'll be appreciated by kids and adults alike stock up for your pantry and upcoming events. A chewier texture meets our bold flavors for a different spin on our long-lasting chews. Each bite turns into a mouthwatering delight with a mildly tangy flavor and ultra-stretchy texture made to savor. With Orange Cream Taffy, you are in for an enjoyable treat! Each Orange Cream flavored taffy has individually wrapped delicious gourmet taffy. We make sure we always have the best of flavors. Our goal is to provide the most flavorful, true-to-life varieties of soft, whipped style taffy you can find. We are always testing new flavors and adding them to our list every year. Soft Orange Cream Taffy flavor is the original, just chewier! Stock up for snacking or a Orange themed party!</p><p>&nbsp;</p><p><strong>About It's Delish!</strong></p><p>&nbsp;</p><p>It's Delish was established in 1992 and is located in North Hollywood, California. It's Delish is a food manufacturer and distributor who produces over 500 gourmet food products including licorice, sour belts, taffies, caramels, Jordan almonds, chocolates, nuts, fruits, trail mixes, spices, and the spice blends. It's Delish also produces organics and all natural products. We give you the opportunity to order from the factory direct!</p><p>&nbsp;</p><p>It’s Delish! prides itself on the four pillars that are at the foundation of everything we do.</p><p>&nbsp;</p><p>Innovation Quality Value Service</p>
Value: 1.0
Unit: Count
",https://m.media-amazon.com/images/I/819VhlQlQuL.jpg,13.99,4.0,Kosher,Non-GMO,,4 Oz Bulk Bag,unisex,USA,It's Delish,,1.0,1,0,0,0,,It's Delish,Orange Cream Taffy Chews,Grocery & Gourmet Food,bar,oz,bag,plastic,"Affordable gourmet taffy with natural ingredients, gluten-free, and dairy-free. Bulk packaging suggests value pricing for parties or treats. Brand emphasizes quality and variety, but not premium positioning. Kosher and non-GMO certifications may slightly elevate perceived value."
48649,"Item Name: Garlic Powder – 10.5 oz
Product Description: Badia Garlic Powder Kosher Garlic Powder One of the most useful and appetizing condiments
Value: 10.5
Unit: Ounce
",https://m.media-amazon.com/images/I/616e8iiHXaL.jpg,9.11,10.5,Gluten-Free,,,,unisex,,,,,1,0,0,0,,Badia,Garlic Powder,Grocery & Gourmet Food,powder,oz,container,plastic,"A standard garlic powder product from Badia, positioned as a versatile and appetizing condiment. The packaging is basic plastic, suggesting a mid-range price point. The gluten-free certification may appeal to specific dietary needs but does not indicate a premium product. The 10.5 oz size offers good value for everyday cooking use."
121629,"Item Name: Good & Gather Naturally Flavored Cinnamon Vanilla Light Roast Ground Coffee
Value: 12.0
Unit: Ounce
",https://m.media-amazon.com/images/I/41rEJeQEJOL.jpg,7.29,12.0,,,,,adult,,,,1.0,1,0,0,0,,Good & Gather,Naturally Flavored Cinnamon Vanilla Light Roast Ground Coffee,Grocery & Gourmet Food,Ground,oz,box,cardboard,"Store-brand coffee with natural flavoring and light roast profile, positioned as an affordable everyday option. Standard cardboard packaging and absence of premium certifications suggest mid-range pricing. Flavor and roast level may appeal to consumers seeking variety without higher-end specialty coffee pricing."
101485,"Item Name: Monin - Coconut Syrup, Creamy Tropical Flavored Syrup, Coffee Syrup, Natural Flavor Drink Mix, Simple Syrup for Coffee, Lemonade, Cocktails, & More, Gluten-Free, Non-GMO, Clean Label (1 Liter, 2-Pack)
Bullet Point 1: GREAT FOR COCKTAILS AND SMOOTHIES: If you like pina coladas, you’ll love the authentic coconut flavor our Coconut Syrup brings to tropical-inspired beverages. Mix up a coco-lime shake, give coffee a coconut twist, or stir up some island cocktails.
Bullet Point 2: TASTING NOTES: Sweet and rich aroma, fresh coconut taste. Monin Coconut Syrup brings creamy, tropical flavor to lemonades, smoothies, shakes and cocktails.
Bullet Point 3: SPECIFICATIONS: Allergen Free, Dairy Free, Gluten Free, Halal, Kosher, No Artificial Colors, No Artificial Flavors, No Artificial Ingredients, No Artificial Preservatives, No Artificial Sweeteners, Non-GMO, & Clean Label
Bullet Point 4: SYRUP TO SUPPORT BEE COLONIES: Colony Collapse Disorder is greatly reducing bee populations worldwide. Our syrup recycling initiative has been sending waste syrup to feed bees since 2008, and has fed over 374 billion bees!
Bullet Point 5: GREEN PACKAGING & LABELING: With BPA free bottles, 100% recyclable boxes comprised of 30% recycled content, printed with biodegradable water-based ink containing zero pollutants, and pulp inserts, we’re doing our part for the environment.
Product Description: If you like pina coladas, you’ll love the authentic coconut flavor our Coconut Syrup brings to tropical-inspired beverages. Mix up a coco-lime shake, give dessert and coffee drinks a coconut twist, or stir up some island cocktails. Monin Coconut Syrup brings creamy, tropical flavor to lemonades, smoothies, shakes and cocktails.
Value: 67.6
Unit: Fl Oz
",https://m.media-amazon.com/images/I/71alx0rTILL.jpg,39.95,2.0,Gluten-Free,Non-GMO,Kosher,"1 Liter, 2-Pack",adult,,,,1.0,1,1,1,0,,Monin,Coconut Syrup,Grocery & Gourmet Food,liquid,l,bottle,plastic,"Premium gourmet syrup with a focus on natural ingredients and clean labeling. The product is positioned as a high-quality flavoring for beverages, with strong branding and eco-friendly packaging. The 2-pack bundle and non-GMO, gluten-free certifications justify a higher price point."
98863,"Item Name: Spry Fresh Natural Xylitol Chewing Gum Dental Defense System - Aspartame-Free, Sugar-Free, Non-GMO, Gluten-Free (Green Tea, 27 Count - Pack of 1)
Bullet Point 1: GREEN TEA GUM: Spry Green Tea gum will help to keep you breath smelling fresh and is moisturizing for your mouth. It’s the ideal freshen up gum that is also good for your teeth. Our gum is conveniently packed with a screw on lid container so you can stay fresh on the road, at work, or with your friends. The natural green tea gives a blast of cool, refreshing flavor, which provides a nice alternative to other aspartame free gum.
Bullet Point 2: IMPROVES TOOTH DENTAL CARE: Clinical studies have shown that the use of xylitol on a daily basis may reduce the risk of tooth decay. Our spry gum is part of an essential dental defense system that may also help fight off cavities. Xylitol is a natural ingredient that inhibits contaminants' ability to stick to your teeth. When contaminants can't stick, they can't colonize. Ask your dentist and hygienist about the amazing benefits of xylitol.
Bullet Point 3: SUGAR FREE XYLITOL GUM: Instead of corn syrup or sugar our gum is made with 100% xylitol. Xylitol sweetener is derived from the fibrous parts of plants, similar in taste to regular organic sugar. We use no filler, flow agents or other sugar additives. Xylitol is a natural sugar that tastes just like real sugar and a great choice when looking for sweetners and sugar alternatives.
Bullet Point 4: NON-GMO GLUTEN FREE NATURAL GUM: Unlike other packs of gum, Spry gum uses natural ingredients that are Non GMO and gluten free. Spry Xylitol gum is 40% lower in calories than other mint gum that contain regular sugars, but contains the same sweetness. It can be a great choice for using in diabetic foods and snacks, keto friendly foods or used in blood sugar support supplements.
Bullet Point 5: FIGHTS BAD BREATH: Use daily after meals and between normal brushes. For best results use Spry Green Tea Gum with Spry Coolmint Toothpaste and Spry Coolmint Oral Rinse for a fresh breath. Spry Green Tea Chewing Gum can help prevent bad breath caused by a poor pH balance, dry mouth, and the lack of saliva. Chewing xylitol gum after meals can increase your saliva output and help neutralize the acids that cause bad breath.
Product Description: Clinical trials have shown the benefits of chewing gum sweetened with Xylitol after meals and snacks. Xylitol is a five-carbon sugar alcohol that has nearly identical taste and bulk to table sugar (sucrose), but with amazing dental benefits! Not only does it have fewer calories and less effect than sucrose, but it also has the added benefit of inhibiting the creation of acid in the mouth. This minimizes the damage done to your teeth, as well as allows your teeth to heal (remineralize) at a faster rate. Xylitol also has a low glycemic index of 7, compared to sugar’s level of 83. It is recommended that you chew a piece of xylitol gum after every meal or snack for maximum benefit to your teeth as it may reduce the risk of decay in the tooth. Xylitol is recommended by dentists, medical doctors, periodontists, pediatricians, and many health organizations and health professionals worldwide as a sweetener for anyone concerned with dental health, upper respiratory health, and sugar consumption, in general. Products sweetened with xylitol create an unwelcome environment for contaminants; study after study has shown that they simply do not stick well to teeth in a xylitol-rich environment.
Value: 27.0
Unit: Count
",https://m.media-amazon.com/images/I/81u+6cgMI5L.jpg,7.69,27.0,,,,"Green Tea, 27 Count - Pack of 1",adult,,,,1.0,1,0,0,0,,Spry,Fresh Natural Xylitol Chewing Gum Dental Defense System,Health & Household,solid,count,container,plastic,"Sugar-free chewing gum positioned as a dental care product with xylitol as the key ingredient. Marketed as non-GMO and gluten-free, targeting health-conscious consumers. Standard plastic container packaging suggests mid-range pricing, not premium. Emphasis on oral health benefits may justify a higher price point compared to regular gum."
5095,"Item Name: Mace Black Tea (Loose) (4 oz, ZIN: 545402) - 3 Pack
Bullet Point 1: Our Mace Black Tea is a tasty flavored Black tea with Nutmeg, Mango Slices and Rose Hips that has a refreshing taste that will impress you! The unique Mace taste is delicious! - Ingredients: Black tea, Nutmeg, Mango Slices, Rose Hips and Natural Mace Flavor.
Bullet Point 2: No fillers.
Bullet Point 3: Manufacturer: TerraVita
Bullet Point 4: Size: 4 oz
Bullet Point 5: Loose Leaf Black Tea - Packed in a convenient upright pouch!
Product Description: Our Mace Black Tea is a tasty flavored Black tea with Nutmeg, Mango Slices and Rose Hips that has a refreshing taste that will impress you! The unique Mace taste is delicious! - Ingredients: Black tea, Nutmeg, Mango Slices, Rose Hips and Natural Mace Flavor. - Hot tea brewing method: Bring freshly drawn cold water to a rolling boil. Place 1 teaspoon of tea for each desired cup into the teapot. Pour the boiling water into the pot, cover and let steep for 2-4 minutes. Strain and pour into your cup; add milk and natural sweeteners to taste. - Iced tea brewing method: (to make 1 liter/quart): Place 5 teaspoons of tea into a teapot or heat resistant pitcher. Pour 1 1/4 cups of freshly boiled water over the tea itself. Steep for 5 minutes. Fill a serving pitcher with 1/4 cold water. Strain and pour the tea into the serving pitcher Add ice and top-up with cold water. Sweeten and garnish to taste. - TerraVita is an exclusive line of premium-quality, natural source products that use only the finest, purest and most potent ingredients found around the world. TerraVita is hallmarked by the highest possible standards of purity, potency, stability and freshness. All of our products are prepared with the highest elements of quality control, from raw materials through the entire manufacturing process, up to and including the moment that the bottles or bags are sealed for freshness and shipped out to you. Our highest possible standards are certified by independent laboratories and backed by our personal guarantee. - TerraVita exists to meet and ensure your family's health and wellness without the harmful effects of chemicals and health products. We strive to make all of our products affordable and reliable and are constantly searching the market to maintain our affordability and to loo
Value: 12.0
Unit: Ounce
",https://m.media-amazon.com/images/I/81YFpeokI1L.jpg,42.74,12.0,,,,Loose Leaf,unisex,,TerraVita,,1.0,1,1,1,0,,TerraVita,Mace Black Tea,Grocery & Gourmet Food,Loose Leaf,oz,pouch,plastic,"Premium loose-leaf black tea blend with natural flavors and no fillers. Positioned as a high-quality, natural product with a focus on purity and potency. The 3-pack bundle offers value, and the brand emphasizes health and wellness without harmful chemicals. Packaging is convenient and resealable, suitable for tea enthusiasts."
31287,"Item Name: Wolfgang Puck Coffee Soft Pods, Jamaican Me Crazy, 18 count (Pack of 1)
Bullet Point 1: To enjoy a little Jamaica in your cup, try Jamaican Me Crazy flavored coffee, liight roast
Bullet Point 2: Infused with rich coconut flavor and an island twist
Bullet Point 3: As a compostable product, pods are the green choice in single cup coffee brewing
Bullet Point 4: Not for use in K cup brewers. This is a POD to be used in machines specifically designed for Pods and not capsules
Value: 18.0
Unit: Count
",https://m.media-amazon.com/images/I/71a1hFpOFaL.jpg,13.95,18.0,Compostable,,,18 count,adult,,,,,1,1,0,0,,Wolfgang Puck,Jamaican Me Crazy Light Roast Flavored Coffee,Grocery & Gourmet Food,Capsule,count,box,cardboard,"Premium coffee brand with celebrity endorsement, featuring compostable pods for eco-conscious consumers. Light roast with coconut flavor suggests a niche, higher-end positioning. Packaging highlights sustainability, which may justify a premium price point. Not compatible with K-cup brewers, indicating a specialized market segment."
280867,"Item Name: NOW Foods, Beef Gelatin Powder, Natural Thickening Agent, Source of Protein, 1-Pound (Packaging May Vary)
Bullet Point 1: NATURAL THICKENING AGENT: NOW Real Food Pure Beef Gelatin is a natural thickener, stabilizer, and texturizer that mixes instantly - no soaking necessary
Bullet Point 2: GOOD SOURCE OF PROTEIN: Mix 1 Tablespoon into your favorite cold juice and consume immediately
Bullet Point 3: CERTIFICATIONS/CLASSIFICATIONS: Low Sodium, Paleo Friendly, Sugar Free
Bullet Point 4: Because you are what you eat, NOW Real Food is committed to providing delicious, healthy, natural, and organic foods. Keep it natural. Keep it real
Bullet Point 5: Packaged in the USA by a family owned and operated company since 1968
Value: 16.0
Unit: Ounce
",https://m.media-amazon.com/images/I/711Bhcv69XL.jpg,14.15,16.0,Non-GMO,,,1-Pound,unisex,USA,NOW Foods,,1.0,1,0,0,0,,NOW Foods,Beef Gelatin Powder,Grocery & Gourmet Food,powder,oz,bag,plastic,"NOW Foods Beef Gelatin Powder is a natural, protein-rich thickening agent marketed as paleo-friendly and keto-compatible. The product is positioned as a health-conscious, functional food ingredient with a focus on natural and non-GMO claims. Packaged in a 1-pound plastic bag, it targets consumers seeking clean-label, versatile food additives."
138785,"Item Name: OFXW1537D - Shortbread Cookies
Bullet Point: Manufacturer: Walkers
Value: 120.0
Unit: Count
",https://m.media-amazon.com/images/I/81QB7E3gS8L.jpg,35.74,120.0,,,,,unisex,Scotland,Walkers Shortbread Ltd.,,,1,1,1,0,,Walkers,Pure Butter Chocolate Chip Shortbread,Grocery & Gourmet Food,solid,count,box,cardboard,"Premium positioning with high-quality packaging and a royal appointment claim. The 120-count bundle deal suggests bulk value, while the pure butter and chocolate chip ingredients indicate a mid-to-high price range. The Scottish heritage and tartan design reinforce premium perception."
277377,"Item Name: Keebler Cheese and Peanut Butter Sandwich Crackers, Single Serve, 1.38 oz Packages, 8 Count(Pack of 6)
Bullet Point 1: Includes 48, 1.38-ounce single-serve Cheese and Peanut Butter Sandwich Crackers Snack Packs; Individually wrapped for freshness and great taste
Bullet Point 2: Light, flaky, cheese-flavored sandwich crackers made with a delicious peanut butter filling for easy snacking at home, school, work, and more
Bullet Point 3: The peanut butter in our delicious sandwich crackers is made with roasted peanuts; Ingredients contain wheat, peanut, milk, and soy
Bullet Point 4: A family-favorite, on-the-go snack that's perfect for both kids and adults
Bullet Point 5: Conveniently packaged and ready to travel; Pop a pack in your kid's backpack and lunchbox; Stow some in your tote bag, car, and desk for anytime snacking
Value: 8.28
Unit: Ounce
",https://m.media-amazon.com/images/I/81EWM2G9yVL.jpg,20.145,8.28,,,,"Single Serve, 1.38 oz Packages, 8 Count (Pack of 6)",unisex,,,,,1,0,1,0,,Keebler,Cheese and Peanut Butter Sandwich Crackers,Grocery & Gourmet Food,solid,oz,bag,plastic,"Family-friendly snack with a bundle deal offering 48 single-serve packs. Convenient packaging for on-the-go consumption, targeting both kids and adults. No premium or organic claims, positioned as an affordable, everyday snack."
