sample_id,catalog_content,image_link,price_x,declared_quantity,certifications_0,certifications_1,certifications_2,variant,target_demographic,country_of_origin,manufacturer,is_organic,is_natural,edible,is_premium,is_bundle_deal,is_limited_edition,price_y,brand_name,product_name,category,product_form,declared_unit,packaging_type,packaging_material,overall_summary
52554,"Item Name: Enjoy Life Mini White Baking Chips, White Chocolate Flavor Gluten Free, School Safe, Non GMO, Dairy Free, Soy Free, Nut Free, Bulk, 12 Bags (9 oz each)
Bullet Point 1: Bulk baking chips that contains (12) 9 oz bags of Enjoy Life Mini White Chocolate Flavor Baking Chips (packaging may vary)
Bullet Point 2: Dairy free white baking chips made in a dedicated nut-free and gluten-free facility from high-quality ingredients
Bullet Point 3: Smaller, indulgent dairy free mini chips are a great alternative to white chocolate for baking and are perfect for melting, treating yourself or baking delicious school safe snacks
Bullet Point 4: Non-GMO Project Verified baking chips are certified gluten free, kosher and halal for a worry-free snack
Bullet Point 5: All Enjoy Life products are certified gluten free, wheat free, peanut free, tree nut free, dairy free, casein free, soy free, egg free, sesame free, mustard free, lupin free, added sulfites free, fish free, shellfish free, and crustacean free
Bullet Point 6: Non-GMO Project Verified baking chips are certified gluten free, kosher and halal for a worry-free snack
Bullet Point 7: All Enjoy Life products are certified gluten free, wheat free, peanut free, tree nut free, dairy free, casein free, soy free, egg free, sesame free, mustard free, lupin free, added sulfites free, fish free, shellfish free, and crustacean free
Value: 108.0
Unit: Ounce
",https://m.media-amazon.com/images/I/81BhDf+gWmL.jpg,70.29,108.0,Non-GMO Project Verified,Certified Gluten-Free,Kosher,"Bulk (12 bags, 9 oz each)",unisex,,,,,1,0,1,0,,Enjoy Life,Mini White Chocolate Baking Chips,Grocery & Gourmet Food,solid,oz,box,cardboard,"Bulk-packaged baking chips positioned for health-conscious, allergen-sensitive consumers, emphasizing safety and compliance with dietary restrictions. The 12-bag multipack (108 oz total) offers cost efficiency for bulk buyers, though the absence of premium branding or organic claims suggests a mid-tier price point. Certifications for gluten-free, Kosher, Halal, and Non-GMO Project Verified add perceived value, targeting parents, bakers, and institutions requiring strict dietary compliance."
239829,"Item Name: Roxy & Rich Fondust Powder Food Color, 4 Grams Tuscan Brown
Bullet Point 1: Fondust is a fantastic coloring product for pastry chefs; it is the only water-soluble color that can be used directly in food; easy to use, Fondust is a microencapsulated food coloring especially designed for coloring food with very low water content; it can be used to color fondant, sugar work (before or after baking), almond paste, royal icing, buttercream, cake mix, macaroons, decorating gel, candy -- practically everything . . . except pure chocolate
Bullet Point 2: Advantages: concentrated color; matte finish; immediate coloring; does not change food consistency; UV-resistant color; free of nuts, lactose and gluten; vegan; 100-percent edible; UV-resistant color. Fondust offers greater fade resistance than coloring gels or pastes; with Fondust, colors keep their intensity longer than other food colors; color fading is caused by UV rays hitting the color; all colors eventually fade (continued in next bullet point)
Bullet Point 3: (Continued from last bullet point) most gel and paste formulas consist of an acidic solution whose pH is below 5, but Fondust is free of acid and free of preservatives; when food colors are exposed to an acid whose pH is below 5, some colors become unstable and fade faster when in contact with UV rays; if you experience increased fading with Fondust, check for acids in the ingredients of the food you are coloring
Bullet Point 4: Fondust is easy to use: simply knead up to 3 grams into 1 kilogram of fondant to achieve maximum color intensity; food products containing titanium dioxide (white pigment) will probably require more Fondust to reach maximum color intensity; Fondust color meets health Canada and the European commission food safety standards; Fondust does not at all affect the taste or the texture of food
Bullet Point 5: With Fondust you will achieve bright or very dark color (depending on which color you're using) in three fast and easy steps: open the jar over a paper towel and dip the fondant into the jar; if you have a lot of fondant, set it in a bowl and add the desired amount of Fondust [maximum 3 grams of Fondust per 0.9 kilograms of fondant (0.1 ounce per 2 pounds)]; knead gently for 2 to 3 minutes, or until the powder is well incorporated into the fondant; now you are ready to begin creating
Product Description: Fondust is a fantastic coloring product for pastry chefs; it is the only water-soluble color that can be used directly in food; easy to use, Fondust is a microencapsulated food coloring designed for coloring food with low water content; it can be used to color fondant, sugar work (before or after baking), almond paste, royal icing, buttercream, cake mix, macaroons, decorating gel, candy -- practically everything…except pure chocolate. Advantages: concentrated color, matte finish, immediate coloring, unchanging food consistency, UV-resistant color. Free of nuts, lactose, gluten; vegan, vegetarian, 100-percent edible (as approved for burgundy by Canada and USA); UV-resistant color: Fondust offers greater fade resistance compared with coloring gels or pastes; with Fondust, colors keep their intensity longer than with other food colors; color fading is caused by UV rays hitting the color; all colors eventually fade; most gel and paste formulas consist of an acidic solution whose pH is below 5, but Fondust is free of acid and free of preservatives; when food colors are exposed to an acid whose pH is below 5, some colors become unstable and fade faster when in contact with UV rays; if you experience increased fading with Fondust, check for acids in the ingredients of the food you are coloring. Fondust is easy to use: Simply knead up to 3 grams into 1 kilogram of fondant to achieve maximum color intensity; food products containing titanium dioxide (white pigment) will probably require more Fondust to reach maximum color intensity; with Fondust you will achieve bright or very dark color (depending on which color you're using) in three fast and easy steps: open the jar over a paper towel and dip the fondant into the jar; if you have a lot of fondant, set it in a bowl and add the desired amount of Fondust [maximum 3 grams per 0.9 kilograms (0.1 ounce per 2 pounds)]; knead gently for 2 to 3 minutes, or until the powder is well incorporated into the fondant; now you are ready.
Value: 0.1411
Unit: Ounce
",https://m.media-amazon.com/images/I/71cYUMlHz+L.jpg,8.29,4.0,,,,Tuscan Brown / Brun Toscan (4 g),unisex,Canada,Roxy & Rich Inc.,,,1,0,0,0,,Roxy & Rich,Fondust Powder Food Color,Grocery & Gourmet Food,powder,g,jar,plastic,"Professional-grade, concentrated food coloring powder designed for low-moisture applications, positioned as a premium alternative to gels/pastes due to UV resistance, acid-free formulation, and gluten-free/vegan compliance. Small 4g quantity suggests niche specialty use rather than mass-market consumption, with pricing likely tied to professional pastry applications. Packaging is functional but not luxury, aligning with a mid-to-high-tier product for artisans rather than casual users."
282304,"Item Name: Blue Diamond Almonds Nut Thin Crackers Crisps, Smokehouse, 4.25 Oz
Bullet Point 1: Irresistible snacking
Bullet Point 2: They're a great afternoon snack
Bullet Point 3: Nut Thins; are a crunchy cracker
Bullet Point 4: Gluten-free meant boring
Value: 4.25
Unit: Ounce
",https://m.media-amazon.com/images/I/61a9vFvnSlL.jpg,4.03,4.25,Certified Gluten Free,Non-GMO Project Verified,,Smokehouse Flavored,adult,,,,,1,0,0,0,,Blue Diamond,NUT-THINS Almond Crisps,Grocery & Gourmet Food,solid,oz,box,cardboard,"Mid-tier snack product positioned as a gluten-free, non-GMO alternative for health-conscious consumers. The packaging emphasizes functional benefits (gluten-free, non-GMO) and flavor variety without premium branding cues. The 4.25 oz (120.5g) size aligns with standard snack pack pricing, targeting value-conscious buyers seeking a crunchy, nut-infused cracker option."
66066,"Item Name: Mother's Day Food Gift Baskets Gourmet Gift Baskets Food Gifts For Women, Mom, Grandma, Sister or Wife Gourmet Food Gifts By Dulcet Gift Baskets
Bullet Point 1: MOTHER'S DAY FOOD GIFT BASKETS - MAKE HER DAY! The ideal gift for Mother’s Day! A Dulcet gift basket is the perfect gift idea to enlighten her day. Gift features; 3 Assorted Brownies-Flavors include: Chocolate Cheese, Chocolate Chip Blondie, and Chocolate Fudge, 20 Assorted Cookies- Flavors include: Chocolate Chip, Peanut Butter, Cranberry White Chip, Oatmeal Raisin, Black and White, Chocolate Dipped and Crinkle, and 1/4 Lb. Assorted Rugelah-Flavors include: Raspberry, Cinnamon Sugar, Apricot, a
Bullet Point 2: QUALITY AND ELEGANCE: Our reusable tin arrives sealed, with the individually wrapped fresh-baked brownies hidden inside. The tin container is accentuated with a “Happy Mother’s Day” sticker and assembled with the utmost care, artfully arranged for prime presentation.
Bullet Point 3: THE SWEETEST MOTHER’S DAY GIFT: Go beyond a simple phone call and surprise your Mom on this special day with this luxurious gift box! Whether she lives far away or close by, there is no better gift than a box of freshly baked creations with a delightful aroma that fills the room the moment she opens the box. After all, she deserves some pampering too!
Bullet Point 4: FRESHNESS: Our goal is to bring you the very best in design. Each Dulcet pastry is individually wrapped to ensure the utmost freshness. All of our amazing pastries. We have the right to change Products and Flavors upon availability for equal valued products.
Bullet Point 5: SATISFACTION: We love our present basket so much, and we're sure you will feel the same. If, for any reason, you or your recipient aren't fully satisfied with our products, we'll be there for you! What are you waiting for? Buy us with confidence!
Product Description: THE SWEETEST MOTHER’S DAY GIFT: Go beyond a simple phone call and surprise your Mom on this special day with this luxurious gift box! Whether she lives far away or close by, there is no better gift than a box of freshly baked creations with a delightful aroma that fills the room the moment she opens the box. After all, she deserves some pampering too!
Value: 1.0
Unit: Count
",https://m.media-amazon.com/images/I/61DNuartYdL.jpg,72.99,,,,,,female,,,,,1,1,0,0,,Dulcet Gift Baskets,Mother's Day Food Gift Baskets,Grocery & Gourmet Food,solid,count,box,metal,"Premium gourmet gift basket designed for a luxury Mother's Day experience, featuring artisanal pastries and a reusable metal tin with elegant branding. Positioned as a high-value, emotional gift with no direct competitors in standard grocery aisles, pricing will reflect its premium presentation, gourmet quality, and curated assortment. The inclusion of fresh-baked items and thoughtful packaging elevates perceived value, justifying a mid-to-high price point typical of specialty gift baskets."
24927,"Item Name: Calypso Lemonades 16 Ounce Glass Bottles 6 Pack (Ocean Blue Lemonade)
Value: 96.0
Unit: Fl Oz
",https://m.media-amazon.com/images/I/41+JhnV92CL.jpg,23.2,16.0,,,,"16 FL OZ (473 ML) BOTTLE, 6-PACK",kids,,,,,1,0,1,0,,Calypso,Ocean Blue Lemonade,Grocery & Gourmet Food,liquid,fl_oz,bottle,glass,"Calypso is positioned as a fun, kid-targeted beverage brand with bright, playful packaging. The 6-pack bundling offers a clear value proposition for families or group consumption, leveraging the novelty of the 'taste of the Caribbean' theme. Glass bottles and vivid design suggest mid-tier quality, while lack of premium or specialty certifications aligns it with mainstream, affordable beverage pricing."
236977,"Item Name: Einstein Bros. Bagels Avocado Toast Seasoning, 5.4 Ounce
Bullet Point 1: Trendy just got a whole lot tastier!
Bullet Point 2: A flavorful blend of sea salt, garlic, onion, a red pepper kick, and hint of lemon flavor!
Bullet Point 3: Top your avocado toast, eggs or salads.
Value: 5.4
Unit: Ounce
",https://m.media-amazon.com/images/I/71a8n3D4oQL.jpg,9.99,5.4,,,,5.4 Ounce,unisex,,,,,1,0,0,0,,Einstein Bros. Bagels,Avocado Toast Seasoning Blend,Grocery & Gourmet Food,granule,oz,jar,plastic,"A trend-focused, specialty seasoning blend positioned for modern food trends, particularly avocado toast. Packaged in a standard plastic jar with no premium or luxury indicators, suggesting mid-range pricing driven by niche appeal and unique flavor profile. The 5.4 oz size offers a balance between portion utility and price accessibility, likely targeting health-conscious or millennial consumers seeking convenient, flavor-enhancing ingredients."
234974,"Item Name: 1 Pound Light Green Sprinkles BULK Jimmies - Edible Cake Cupcakes Dessert & Ice Cream Topping-Lime Green Sprinkles
Bullet Point 1: ELEVATE YOUR DESSERTS WITH DELICIOUS LIME GREEN JIMMIES: Lime green Jimmies sprinkles are a popular decoration that is loved by dessert enthusiasts around the world. These tiny, colorful sprinkles come in a beautiful shade of green, adding a pop of color and texture to any dessert they are sprinkled on. They are often used to decorate cakes, ice cream, cookies, and other sweet treats. Lime green Jimmies sprinkles are a perfect addition to any dessert and are sure to bring joy to anyone.
Bullet Point 2: ADD TEXTURE AND COLOR TO COOKIES: Lime green jimmies are the perfect addition to any baker's decorating arsenal. These tiny, crunchy, and colorful sprinkles are ideal for decorating cakes, cupcakes, and cookies. When it comes to decorating cakes, Lime green jimmies can be used in a number of ways. They can be sprinkled on top of a frosting swirl for a simple, elegant look, or mixed with other sprinkles to create more intricate designs.
Bullet Point 3: MAKE YOUR ICE CREAM EVEN MORE DELICIOUS: Lime green Jimmies are a wonderful addition to any ice cream lover's collection of toppings. Not only are Lime green Jimmies visually appealing, but they're also a delicious way to add some sweetness to your ice cream. These small, brightly colored candy decorations add a pop of color and a satisfying crunch to your favorite frozen treats. Whether you're enjoying a classic ice cream, Lime green Jimmies are a great way to add some texture and flavor.
Bullet Point 4: ELEVATE YOUR CAKE POPS WITH CRUNCHY LIME GREEN JIMMIES: Lime green jimmies are a great way to add a fun and playful touch to cake pops. These crunchy sprinkles can be used to create a textured outer layer, giving your cake pops an extra crunch that complements the soft and creamy center. Lime green jimmies are a fun and colorful ingredient to use when making cake pops. Adding Lime green jimmies to your cake pop decoration repertoire is sure to impress your guests and satisfy your sweet tooth.
Bullet Point 5: ELEVATE YOUR CAKE POPS WITH CRUNCHY LIME GREEN JIMMIES: Lime green jimmies are a great way to add a fun and playful touch to cake pops. These crunchy sprinkles can be used to create a textured outer layer, giving your cake pops an extra crunch that complements the soft and creamy center. Lime green jimmies are a fun and colorful ingredient to use when making cake pops. Adding Lime green jimmies to your cake pop decoration repertoire is sure to impress your guests and satisfy your sweet tooth.
Bullet Point 6: A VERSATILE MUST-HAVE FOR ANY BAKER: Lime green jimmies is a versatile topping that is ideal for both professional bakers and home cooks. Professional bakers often use Lime green jimmies to create intricate and eye-catching decorations. Home cooks, on the other hand, can use Lime green jimmies to elevate their everyday baking projects, such as cookies, cupcakes, and brownies Lime green jimmies are a must-have item for anyone looking to add some flair and fun to their baking projects.
Bullet Point 7: MAKE A SPLASH AT YOUR NEXT PARTY WITH LIME GREEN JIMMIES: Lime green Jimmies is a great choice for themed parties or ocean-inspired color schemes. Not only are Lime green Jimmies appealing, but they're also a crunch to your baked goods. Whether you want to add color to your treats, Lime green Jimmies is a versatile option. So why not grab a bottle of Lime green Jimmies and get creative with your next party dessert? Your guests are sure to love the added touch of color and flavor!
Bullet Point 8: PERFECT ADDITION TO YOUR BABY SHOWER DESSERTS: Lime green jimmies are a perfect choice for baby shower desserts. Their beautiful Lime green color can be used to complement a gender-neutral theme or to add a pop of color. For a fun and simple baby shower dessert idea, you can use Lime green jimmies to decorate classic sugar cookies in the shape of baby bottles, onesies, or pacifiers. Simply frost the cookies with white icing and sprinkle Lime green jimmies on top for a cute and colorful touch.
Bullet Point 9: COMBINING WITH OTHER TOPPINGS FOR A SWEET SENSATION: Lime green jimmies can be combined with other candy toppings to create unique and eye-catching decorations. You could mix Lime green jimmies with other colors of jimmies to create a rainbow effect. Lime green jimmies can also be paired with other candy toppings that complement their color and flavor. Let your creativity run wild and experiment with different combinations to see what works best for your sweet treats.
Bullet Point 10: SURE TO SATISFY YOU: At Naturejam, we are dedicated to providing you with the good quality products and services. We want to ensure a hassle-free experience for you.
Product Description: ""If you're looking to add a touch of sweetness and whimsy to your next party or event, consider incorporating lime green edible sprinkles for ice cream and cake decorating into your decor. These sprinkles come in a soft shade of green that enhances the beauty of any event and adds a fun, festive touch to any dessert. lime green sprinkles are elongated, rod-shaped sprinkles that are sure to please both children and adults alike. Lime green sprinkles satisfy your sweet tooth and add a playful touch to any dessert. Whether you're treating yourself or a loved one, Lime green sprinkles for cake decorating are the perfect choice. Not only are Lime green sprinkles a tasty treat, but they also make great edible decorations for desserts such as cakes, cupcakes, or even on top of your favorite ice cream. These high-quality sprinkles add a real touch of excitement to candy buffets and can be used to enhance baked goods and ice cream. The simplest way to use Lime green sprinkles is to sprinkle them over frosting, adding a pop of color and texture to the dessert. These Lime green sprinkles make a great addition to any celebration, from children's birthdays to gender reveals, baby showers, anniversaries, ocean-themed desserts, or any special occasion. ""
Value: 16.0
Unit: Ounce
",https://m.media-amazon.com/images/I/912mdrJ6WAL.jpg,12.99,16.0,,,,"Lime Green, 1 lb (16 oz)",unisex,,,,,1,0,0,0,,,Light Green Sprinkles (Jimmies),Grocery & Gourmet Food,granule,oz,,,"Bulk edible sprinkles marketed as a versatile, budget-friendly decorative topping for desserts, ideal for home bakers and party planners. Positioned as a fun, colorful, and crunchy addition to cakes, ice cream, and cookies, with no premium or specialty claims. The 1 lb (16 oz) size suggests a value-oriented, high-volume product for frequent use, appealing to cost-conscious consumers while lacking certifications or organic claims that could justify higher pricing. Packaging and material details absent, but bulk format implies cost efficiency and broad applicability for festive or everyday baking."
77130,"Item Name: Lily's Dark Chocolate with Stevia Coconut - 3 oz
Product Description: Certified Organic by USDA. Lily's - Dark Chocolate Bar 55% Cocoa&nbsp;Coconut - 3 oz. (85g)Lily's Dark Chocolate Bar 55% Cocoa&nbsp;Coconut is&nbsp;the perfect tropical balance of dark chocolate and organic coconut.&nbsp;This&nbsp;stevia-sweetened premium dark chocolate has all the indulgence you crave with 25% fewer calories than other 55% dark chocolates. Lily's uses only the finest non-GMO ingr
Value: 3.0
Unit: Ounce
",https://m.media-amazon.com/images/I/51Zg6idNdaL.jpg,8.97,3.0,USDA Organic,Fairtrade,Gluten-Free,"55% Cocoa, Stevia-Sweetened, Dark & Rich",adult,,,1.0,,1,1,0,0,,Lily's,Coconut Dark Chocolate,Grocery & Gourmet Food,bar,oz,wrapper,other,"Premium health-oriented chocolate bar with organic, gluten-free, and non-GMO certifications, emphasizing reduced sugar and stevia sweetening. Positioned as a diet-conscious indulgence with tropical flavor differentiation. Packaging design and premium branding suggest a mid-to-high-end price point, leveraging certifications and ingredient quality for perceived value."
89626,"Item Name: Grandma's Chocolate Brownie Cookie, 2.5 Ounce (60 Cookies)
Value: 86.4
Unit: Ounce
",https://m.media-amazon.com/images/I/81Qy0u7UFtL.jpg,37.95,2.5,,,,2.5 Ounce (60 Cookies),adult,,,,,1,0,0,0,,Grandma's,Chocolate Brownie Cookie,Grocery & Gourmet Food,solid,oz,pouch,plastic,"Mid-tier branded snack positioned as a nostalgic, homemade-style treat with a classic chocolate brownie flavor. Standard 2.5 oz resealable pouch packaging suggests convenience and portion control, targeting adult consumers seeking a familiar indulgent snack. The absence of organic, premium, or limited-edition claims, combined with a generic plastic pouch, indicates a value-oriented pricing strategy typical of mass-market bakery products."
44975,"Item Name: Starbucks Sugar-Free Vanilla Syrup (1-L.)
Bullet Point 1: The authentic syrup used at Starbucks
Bullet Point 2: Makes dozens of beverages
Bullet Point 3: Roast: medium, balanced, smooth & rich^Tasting notes: lively & balanced
Product Description: Anything but plain, this delicious vanilla flavored syrup is sweet, versatile, and sugar-free. So go ahead, sweeten anything from beverages to desserts. It's easy to add a shot of rich-tasting, sugar-free vanilla to the specialty coffee drinks you make at home.
Value: 33.8
Unit: Fl Oz
",https://m.media-amazon.com/images/I/51sTCibac8L.jpg,35.99,1.0,,,,1-Liter (33.8 FL OZ),unisex,,,,1.0,1,1,0,0,,Starbucks,Sugar-Free Vanilla Syrup,Grocery & Gourmet Food,liquid,l,bottle,plastic,"Premium-branded syrup with strong brand recognition and a focus on authenticity, targeting coffee enthusiasts and home baristas. The sugar-free claim and natural flavor positioning cater to health-conscious consumers, while the 1-liter size offers cost efficiency for frequent use. Plastic bottle packaging aligns with standard liquid syrup formats, reinforcing a balance between accessibility and perceived quality through the Starbucks brand association."
